{
 "$schema": "https://json-schema.org/draft/2020-12/schema",
 "$id": "https://alphakeel.local/contracts/strategy-ir/1/schema.json",
 "title": "alphakeel.strategy-ir/1",
 "description": "Strategy IR v1. Shape only; cross-field rules (parameter paths, pair/shape consistency, lo <= hi, declared strategy_id) are in README.md section 3.",
 "type": "object",
 "additionalProperties": false,
 "required": [
  "schema",
  "name",
  "kind",
  "universe",
  "assumptions",
  "entry",
  "exit",
  "sizing",
  "parameters",
  "provenance"
 ],
 "properties": {
  "schema": {
   "const": "alphakeel.strategy-ir/1"
  },
  "strategy_id": {
   "type": "string",
   "pattern": "^ir-[0-9a-f]{24}$"
  },
  "name": {
   "type": "string",
   "minLength": 1
  },
  "kind": {
   "const": "cross_venue_carry"
  },
  "universe": {
   "type": "object",
   "additionalProperties": false,
   "required": [
    "pairs",
    "shape",
    "excluded_bases"
   ],
   "properties": {
    "pairs": {
     "oneOf": [
      {
       "const": "any"
      },
      {
       "type": "array",
       "minItems": 1,
       "uniqueItems": true,
       "items": {
        "type": "array",
        "prefixItems": [
         {
          "$ref": "#/$defs/venue"
         },
         {
          "$ref": "#/$defs/venue"
         }
        ],
        "minItems": 2,
        "maxItems": 2
       }
      }
     ]
    },
    "shape": {
     "enum": [
      "cross_perp",
      "spot_perp",
      "equity_perp"
     ]
    },
    "excluded_bases": {
     "type": "array",
     "items": {
      "type": "string",
      "pattern": "^[A-Z0-9]+$"
     }
    },
    "quote_ccys": {
     "type": "array",
     "minItems": 1,
     "uniqueItems": true,
     "items": {
      "type": "string",
      "pattern": "^[A-Z0-9]+$"
     },
     "default": [
      "USDT"
     ]
    },
    "bases": {
     "type": "array",
     "minItems": 1,
     "uniqueItems": true,
     "items": {
      "type": "string",
      "pattern": "^[A-Z0-9]+$"
     }
    }
   }
  },
  "assumptions": {
   "type": "object",
   "additionalProperties": false,
   "required": [
    "horizon_hours",
    "basis_stress",
    "funding_estimate"
   ],
   "properties": {
    "horizon_hours": {
     "type": "integer",
     "minimum": 1,
     "maximum": 4294967295
    },
    "basis_stress": {
     "$ref": "#/$defs/decimal",
     "description": "fraction in [0, 1)"
    },
    "funding_estimate": {
     "enum": [
      "predicted",
      "last_settled"
     ]
    }
   }
  },
  "entry": {
   "type": "object",
   "additionalProperties": false,
   "required": [
    "conditions",
    "rank_by",
    "candidate_limit",
    "cooldown_minutes",
    "one_per_base"
   ],
   "properties": {
    "conditions": {
     "type": "array",
     "items": {
      "$ref": "#/$defs/condition"
     }
    },
    "rank_by": {
     "$ref": "#/$defs/feature"
    },
    "candidate_limit": {
     "type": "integer",
     "minimum": 1,
     "maximum": 200
    },
    "cooldown_minutes": {
     "type": "integer",
     "minimum": 0,
     "maximum": 4294967295
    },
    "one_per_base": {
     "const": true
    }
   }
  },
  "exit": {
   "type": "object",
   "additionalProperties": false,
   "required": [
    "max_hold_hours",
    "max_loss",
    "take_profit",
    "conditions"
   ],
   "properties": {
    "max_hold_hours": {
     "type": "integer",
     "minimum": 1,
     "maximum": 4294967295
    },
    "max_loss": {
     "$ref": "#/$defs/decimal",
     "description": "quote amount > 0"
    },
    "take_profit": {
     "oneOf": [
      {
       "$ref": "#/$defs/decimal"
      },
      {
       "type": "null"
      }
     ],
     "description": "quote amount > 0, or null"
    },
    "conditions": {
     "type": "array",
     "items": {
      "$ref": "#/$defs/condition"
     }
    }
   }
  },
  "sizing": {
   "type": "object",
   "additionalProperties": false,
   "required": [
    "notional_per_leg",
    "max_open",
    "leverage"
   ],
   "properties": {
    "notional_per_leg": {
     "$ref": "#/$defs/decimal",
     "description": "quote amount > 0"
    },
    "max_open": {
     "type": "integer",
     "minimum": 1,
     "maximum": 50
    },
    "leverage": {
     "oneOf": [
      {
       "$ref": "#/$defs/decimal"
      },
      {
       "type": "null"
      }
     ],
     "description": "> 0, or null = runtime value"
    },
    "margin": {
     "type": "object",
     "additionalProperties": false,
     "required": [
      "mode",
      "reduce_above",
      "reduce_to"
     ],
     "description": "Optional (2026-10-18). Portfolio-margin bookkeeping; spot_perp only and 0 < reduce_to < reduce_above < 0.95 (README section 3). Absent = isolated margin, not part of the definition.",
     "properties": {
      "mode": {
       "enum": [
        "portfolio"
       ]
      },
      "reduce_above": {
       "$ref": "#/$defs/decimal",
       "description": "daily ratio above which both legs are reduced; < 0.95"
      },
      "reduce_to": {
       "$ref": "#/$defs/decimal",
       "description": "target ratio after a reduction; 0 < reduce_to < reduce_above"
      }
     }
    }
   }
  },
  "parameters": {
   "type": "object",
   "additionalProperties": {
    "type": "object",
    "additionalProperties": false,
    "required": [
     "value",
     "robust",
     "path"
    ],
    "properties": {
     "value": {
      "$ref": "#/$defs/decimal"
     },
     "robust": {
      "type": "array",
      "prefixItems": [
       {
        "$ref": "#/$defs/decimal"
       },
       {
        "$ref": "#/$defs/decimal"
       }
      ],
      "minItems": 2,
      "maxItems": 2
     },
     "path": {
      "type": "string",
      "pattern": "^(entry|exit|sizing|assumptions)(\\[[0-9]+\\])*(\\.[a-z_]+(\\[[0-9]+\\])*)*$"
     }
    }
   }
  },
  "execution": {
   "$ref": "#/$defs/execution"
  },
  "provenance": {
   "type": "object",
   "required": [
    "tool",
    "window"
   ],
   "properties": {
    "tool": {
     "type": "string",
     "minLength": 1
    },
    "window": {
     "type": "object",
     "required": [
      "start",
      "end"
     ],
     "properties": {
      "start": {
       "type": "string"
      },
      "end": {
       "type": "string"
      }
     }
    },
    "fixed_literals": {
     "type": "object",
     "description": "Optional. Numeric literals of the entry/exit expressions that are deliberately fixed (not tuned and not declared as parameters): path (same grammar as parameters.*.path) -> the literal's value. AlphaKeel G1 1.19 requires each value to equal the one in the IR; 0, 1, 24, 60, 1000 and 3600 need no entry.",
     "additionalProperties": {
      "$ref": "#/$defs/decimal"
     }
    },
    "research_credential": {
     "type": "string",
     "minLength": 1,
     "description": "Optional. The research-service credential id the research used (/whoami `credential`). AlphaKeel G1 1.14 (protocol 2.5) requires it to be a research credential the service knows."
    },
    "data_exposure_end_ms": {
     "type": "integer",
     "description": "Optional. The latest end (milliseconds) of all data the research read, including direct pulls outside the research service (VT data_audit). AlphaKeel G1 1.14 (protocol 2.5) counts it in the research horizon."
    }
   }
  }
 },
 "$defs": {
  "decimal": {
   "type": "string",
   "pattern": "^-?(0|[1-9][0-9]*)(\\.[0-9]*[1-9])?$",
   "not": {
    "const": "-0"
   }
  },
  "venue": {
   "enum": [
    "binance",
    "okx",
    "bybit",
    "bitget",
    "gate",
    "aster",
    "hyperliquid",
    "lighter",
    "backpack",
    "ibkr"
   ]
  },
  "feature": {
   "enum": [
    "funding_hourly_net",
    "funding_apr",
    "funding",
    "basis",
    "spread",
    "fees",
    "stress",
    "net_expected",
    "net_conservative",
    "volume_min",
    "quote_age_ms",
    "leg_skew_ms",
    "price_estimated",
    "funding_apr_7d",
    "funding_apr_30d",
    "funding_pos_share_30d",
    "borrow_apr",
    "borrow_utilization",
    "borrow_cap_used",
    "entry_edge",
    "listing_age_hours"
   ]
  },
  "condition": {
   "type": "object",
   "additionalProperties": false,
   "required": [
    "feature",
    "op",
    "value"
   ],
   "properties": {
    "feature": {
     "$ref": "#/$defs/feature"
    },
    "op": {
     "enum": [
      ">=",
      "<=",
      ">",
      "<",
      "between"
     ]
    },
    "value": {
     "oneOf": [
      {
       "$ref": "#/$defs/decimal"
      },
      {
       "type": "array",
       "prefixItems": [
        {
         "$ref": "#/$defs/decimal"
        },
        {
         "$ref": "#/$defs/decimal"
        }
       ],
       "minItems": 2,
       "maxItems": 2
      }
     ]
    },
    "min_hold_hours": {
     "type": "integer",
     "minimum": 1,
     "maximum": 4294967295,
     "description": "Optional (2026-10-18). exit.conditions only (README section 3): the condition does not take part until the position has been held this many hours."
    }
   },
   "if": {
    "properties": {
     "op": {
      "const": "between"
     }
    }
   },
   "then": {
    "properties": {
     "value": {
      "type": "array"
     }
    }
   },
   "else": {
    "properties": {
     "value": {
      "type": "string"
     }
    }
   }
  },
  "maker_entry": {
   "type": "object",
   "additionalProperties": false,
   "required": [
    "model",
    "timeout_s"
   ],
   "properties": {
    "model": {
     "enum": [
      "M1",
      "M2"
     ],
     "description": "M1: a 1m trade bar trades at least one tick through the limit; M2: the whole bar is beyond it (README section 5b)"
    },
    "timeout_s": {
     "type": "integer",
     "minimum": 120,
     "maximum": 3600
    },
    "participation": {
     "$ref": "#/$defs/decimal",
     "description": "(0, 0.25]; default \"0.05\" (written out in the definition)"
    },
    "chase": {
     "enum": [
      "taker"
     ],
     "description": "the unfilled rest after the timeout is chased taker; default \"taker\""
    }
   }
  },
  "leg_entry": {
   "oneOf": [
    {
     "const": "taker"
    },
    {
     "type": "object",
     "additionalProperties": false,
     "required": [
      "maker"
     ],
     "properties": {
      "maker": {
       "$ref": "#/$defs/maker_entry"
      }
     }
    }
   ]
  },
  "execution": {
   "type": "object",
   "additionalProperties": false,
   "description": "Optional (2026-10-17). Absent, {} or every leg \"taker\" = all taker and not part of the definition (same strategy_id). At most one entry leg may be maker (README section 3); exits are taker.",
   "properties": {
    "entry": {
     "type": "object",
     "additionalProperties": false,
     "properties": {
      "long": {
       "$ref": "#/$defs/leg_entry"
      },
      "short": {
       "$ref": "#/$defs/leg_entry"
      }
     },
     "description": "each leg defaults to \"taker\""
    },
    "exit": {
     "const": "taker",
     "description": "default \"taker\""
    }
   }
  }
 }
}
